CARD_0001_BODY;サイランドの若者達は、草原で働きながら勇ましい冒険家として旅立つのを夢見ることがよくある。悲しいことに、彼らが待ち望んだ冒険に出た時、その日1日生き延びる者すら稀である。
CARD_0022_BODY;マーナストの都市に住む人々は、帝国の驚異的な技術によって提供される安全さや快適さを受け入れるため、伝統や自由を諦めることがたびたびある。田舎の人々は都市の人々より気高き理想を信仰しており、自由の名の下で皇帝と戦い続ける。
CARD_0024_BODY;反乱軍が隼をシンボルとした時、帝国軍は最初それを笑っていたが、訓練を受けた反乱軍の隼たちの恐ろしさをすぐに学んだ。
CARD_0030_BODY;温厚なヤクは、草が生えているほとんどの場所で見つけることができる。農民はその土地のヤクと友達になることが多い。彼らはその大きな動物に荷車の運搬や耕作を手伝ってもらい、お礼に牧草と小屋を喜んで提供する。
CARD_0034_BODY;女王マグダーは沢山の友人のおかげで、マーロバルにおける司法制度のほとんどを掌握している。その忠誠に報いるため、女王はお気に入りたちがいかなる違法行為に与しようとしても、違法行為による法的な権利・義務が彼らに及ばないようにする。
CARD_0036_BODY;夫の鉄拳支配を包み込むビロードの手袋。そのような政治的な意味合いが強い結婚だったからといって、愛が失われているわけではないけれども。マグナスが王国騎士団と民衆関係を支配する一方で、マグダーは社会の上流階級を賄賂、諜報、そして時には暗殺によって支配する。
CARD_0040_BODY;「氷河の狐」として知られる、その狡猾な王はマーロバルの193代目の支配者である。建国からの4000年間、マーロバル王家の「偉大な白牡鹿」は度々その黒曜石の要塞から浸出してきた。
CARD_0043_BODY;盗賊の襲撃で家族を失った後、シャーラーは謎に包まれた師の養子となった。師は秘密結社ドラゴンハンターズのリーダーであった。幾年もの訓練ののち、彼女は結社で最も腕の良いハンターとなり、師によって世に送り出された。できるだけ多くの竜を屠り、伝説の「竜の日」を防ぐために。
CARD_0047_BODY;皇帝が金の玉座から支配するマーナストの都市では、小さな荒れ放題の公園がある。その中心には雑草や蔦のからみついた、力強く、美しく、輝く女性の像がある。時間と苔の層の下に隠されて、石に彫り込まれているのは、「悲しみの貴婦人 ラヤ」という言葉である。
CARD_0051_BODY;かつて帝国軍の主力だった執行者が現在のマーナストの田舎をパトロールしている。公式にはティキ族とオードリムの連合を防ぐ名目だが、これらの機械はそれよりも異議を叩き潰したり、反逆拠点を絶ったりするために使われている。
CARD_0052_BODY;マーロバルの貴族は皆王国のいずれかの騎士団に所属する。しかし、最も技術と貢献度の高い者はマーロバル騎士団に所属する。その騎士団は、王の命とその秘密の両方の防衛に割り当てられる。
CARD_0053_BODY;ある日ドラゴンたちが結託し、世界の人間の痕跡を全て消し去るという予言がある。人類はその予言を恐ろしく、回避したいものだと考える一方、他の多くの種族は予言の日を待ち望んでいる。
CARD_0056_BODY;マグナスとマグダーの権力争いにおいて、サルガーは両方の側に立とうとする。いつの日か彼らがお互いに破滅し、玉座が彼の者になることを望んでいるのだ。しかしながら、サルガーは気づいていない。君主はどちらも彼の企みに気づいており、サルガーと彼の野心を意味のない仕事で忙殺し続けるという合意が交わされていたのだ。
CARD_0060_BODY;法廷を掌握しているので、女王マグダーにとって誰かを法的に処刑することは難しくない。しかし、そうできない稀な人物のため、彼女は他のたくさんの方策を用意している。
CARD_0064_BODY;帝国の資源への渇望は全てを消費しつくすほど強く、彼らは土地や住人のことを考えず、たびたび一つの地域のフェアリアを完全に枯渇させる。
CARD_0071_BODY;海はどこもルビーフィッシュの群れに満ちている。しかし、ギャブリアの周辺の水辺ほどに溢れている場所はない。ギャブリアでは海洋と夢の女神アルアのお気に入りの生物として扱われている。
CARD_0083_BODY;トライトンは何年もの間平和に過ごしてきたが、彼らはその平和のぬるま湯につかることはなかった。防壁をほとんど意味のないものに変える、生まれもっての才能に結びついた訓練に打ち込み、彼らは世界で最も偉大な戦士となった。
CARD_0104_BODY;永遠の視点から見ると、世界全体はウロボロスの寝ていた無限の海に他ならない。4柱の神が世界に介入し創造を始めると決めた時、その巨大な蛇が波紋を起こして寝返りを打った。アルアはその波を見て、波にバエルという命を与えた。そうして最初のエレメンタルを作った。
CARD_0108_BODY;オローセイは夢の領域パンドラの守護者である。そこには神々の記憶と伝説が安置されている。トライトンの商人フーゴロがパンドラへの扉を開く方法を見つけ、どんな盗賊や探検家でもその領域に入ってこられるようになるまで、彼女は平和な生活を送っていた。
CARD_0114_BODY;アーロラーは周りの人の夢にいつでも入っていくことができた。そして適切な導きが必要な人々に対しては、その夢をあるべき未来像に変えた。この数百年、彼女はその改変をより頻繁に行い、世界の目立った象徴の大部分の成り立ちにアーロラーの夢が何らかの形で関与していることを示した。
CARD_0125_BODY;世界のもっとも謎めいた住人の一人。彼女は数千年前に記憶を持たずに目覚めた。しかしながら、ある深遠な知識と不思議な能力に取りつかれていた。彼女は自分がどうやって生まれてきたかは知らないのに、既に自分の目的を見つけていた。それは終末的な破滅の道から世界を救うことである。
CARD_0133_BODY;ティキ族は動物や植物の生霊と親しく交流するのに対して、サガミ族は自然のより闇の深い要素と交わる。シャーマンはこれらの血に飢えた霊を複雑な彫刻が施されたマスクに閉じ込めることで、強大な力を吹き込む。シャーマンが死んだとき、彼ら自身の魂が新しい面に封じられ、その力を種族の中に残すことはよくある。
CARD_0140_BODY;ティキ族は全ての命の尊さを信じている。族長から最年少の戦士まで、あらゆる同族達は、病気や怪我を抱えた動物や植物のため、時々森に出かけることがある。
CARD_0144_BODY;自然に危機が迫ると、ティキ族のシャーマンはしばしば彼らの神聖な動物達に純粋なフェアリアを注ぎ込み、それらを恐ろしい巨獣へ変える。マーナスト帝国による絶え間ない攻撃により、ティキ族はこの技法をより頻繁に行使しなければならず、残された守護者の獣は絶えず続く戦いに激怒していた。
CARD_0150_BODY;人間たちには長い間忘れ去られていたが、サイリアは巨大な王国の中でも最も大きな国だった。巨人戦争の間に彼らは巨大なゴーレムを作り出し、彼らの敵を握り潰していった。今もこれらの巨大な創造物は、創造主がこの世界を去った後も残存している。
CARD_0169_BODY;最も旧い元素の竜であるテスラは神聖なる森の遥か高みにある彼女のねぐらから大地に残る自然を見つめている。彼女はかつてドラゴンスレイヤーシャーラーを打ち倒したが、その若者を導く強力な運命を感じ取ったとき、その少女の命を救った。
CARD_0175_BODY;ゆっくりと絡み合う古き森の心臓部において、老木はこの場所に住まう最も温厚な精霊をも更に落ち着かせている。彼らは一見すると無害で無邪気に見えるが、警告もなしにモンスターに変わることがある。
CARD_0179_BODY;世界を破壊しようとするウロボロスを止めるためガイアが彼女自身の身を捧げた時、3つの種がその光に触れ偉大な力を吹き込まれた。そのうちの1つは豊かで肥沃な土地へ落ち、高く、知覚を持った樹へと成長した。その樹から、エリアナの森全体が育った。
CARD_0185_BODY;原野の奥深くまで進めば進むほど、もっと恐ろしい怪物に遭遇するだろう。最も深いところでは、空腹の声を見つけることになる。かつてサガミのシャーマンであった者。彼らは面を失い、彼らが支配しようとした闇と貪欲の力に負け、支配された。
CARD_0187_BODY;ウタハヤブサ族の頭であるエラドンは存命の最も偉大な音楽家であるだけでなく、カリスマを持つリーダーであり賢明な戦略家である。そのため、彼は12のティキ族の代表者として推戴され、帝国に抗い戦う緑の連盟の軍隊を指揮する。
CARD_0189_BODY;何千年もの昔、エンクゥというティキ族の偉大な音楽家をルーニンが助けてあげてから、ティキ族はルーニンの助けを呼ぶため、また、彼女に感謝するためフルートの曲を演奏する。
CARD_0190_BODY;世界を破壊しようとするウロボロスを止めるためガイアが彼女自身の身を捧げた時、3つの種がその光に触れ偉大な力を吹き込まれた。そのうちの1つは地面に触れる前に空中で飢えた狼に奪われその狼に大きな肉体と力、永遠の命を与えた。
CARD_0202_BODY;剣闘士の闘技場で生まれ、サイファーはコボルドの精鋭を喜ばせるための殺戮兵器そのものになるように訓練された。彼はコボルドの社会にうんざりして、血に染まった反乱のリーダーとなった。そして一人世界の果てへと逃げのびたが、そこは残忍な悪魔の支配する場所であった。再び誰かの奴隷になることは絶対に受け入れられず、彼は恐怖の王の力を盗み、彼らの土地を自分の所有地とした。
CARD_0204_BODY;クログはかつて自分が王であればと夢みたが、彼は小さすぎたため、他の誰もそれに賛成しなかった。そこで彼はたくさん食べ、大きく太く成長した。しかしながらそれでも周囲の答えはノーであった。なので彼はたくさんの食べ物、飲み物を用意して宴会を開いた。彼の種族全員が来た。とうとうクログは王となった。食べ物が尽きた時、集まった皆も去る。だが、さらなるごちそうがあれば、彼は再び王となるだろう。
CARD_0215_BODY;ほとんどの悪魔が人よりも獣に近い本能的な生き物である中で、恐怖の王は世界で最もやり手の存在であった。サイファーによる虐殺と領地の強奪が起きるまで何世紀にもわたって、悪魔たちは悪魔平原の支配権をめぐって争ってきた。残った王たちは東の島々に逃れ、復権の機会を待った。
CARD_0218_BODY;戦いにおいて、大きな悪魔は小さな悪魔を口に入れ、守ることがある。小さい悪魔が戦闘の後飲み込まれてしまう頻度を考えると、部外者にはこれが本当に安全なのかどうかはっきりわからない。
CARD_0232_BODY;大地と火の神アオロスに捧げられたガルダンの愛は、その神が世界を喰らうウロボロスに飲み込まれたとき、怒りと悲しみに変わった。彼は火の怒りを田舎に爆発させた。一方、冷たい一人の夜を金のベッドと涙の中ですごした。
CARD_0250_BODY;ウロボロスが初めて寝返りを打った時、煌々と輝くその瞳が一瞬開き、恐ろしい烈火が漏れ出て、無限の海が燃やし尽くされる恐れをもたらした。炎の神アオロスはこの烈火を手懐け、原初の炎 イグナスを創った。
CARD_0253_BODY;カリムが聖戦を開始したとき、彼は戦争の経験のない多くの市民をマーナストとの戦いに導いた。今では技術者や聖職者、商人は鍛錬された戦士となった。そして彼らこそが、カリムをすべての人類に対する大虐殺へと導く。
CARD_0256_BODY;オードリムは強い感情と機知に富んだ心を持つ種族である。彼らはディジダンの秩序から集中、祈祷、仲裁の方法を学んだ。もしもこの出来事がなければ、全てのオードリムの民は狂信的に駆り立てられた情熱に身を滅ぼされ、絶滅の日を迎える危険に晒されていただろう。
CARD_0260_BODY;戦の天才カリムは、彼のディジダンにおける師匠が忠告していた通り、マーナスト帝国との聖戦にすっかり囚われてしまった。当初は帝国が聖髄を燃料として用いることを止めるための戦いであったが、オードリムの民が全ての人類を世界から一掃することを求めるようになって以来、聖戦は虐殺と呼ぶべきものへと変貌した。
CARD_0263_BODY;狩りを行うシェータンは、標的の見る夢をかき乱すことがある。この方法は獲物と彼らの距離を問題としない。多くの者がこの悪夢による苦しみで命を落とす。
CARD_0288_BODY;アザライの血への欲求があまりにも強大であったため、風と空の神アスターは彼女が狩りで世界を滅ぼす前に封じ込めねばならなかった。再び自由を得てからの彼女は、失った時間を取り戻そうとするかのようにまた狩りを続けている。
CARD_0297_BODY;シェータンの中には、ウロボロスの光に呪いをかけられるよりも以前の記憶を持つほど長く生き続ける者もいる。重ねた時間は彼らの身に偉大な力と決意を宿し、彼らは他の同族が何を目的としているかはほとんど気にせず、未知の目的に向かって突き進んでいる。
CARD_0299_BODY;シェータンは他のクリーチャーのように繁殖することはない。その代わりに、ウロボロスの司祭がシェータンの心の炎を彼らの捕虜の魂に点火し、悪魔のみが残るまで良心を全て焼き尽くすことによって誕生する。
CARD_0303_BODY;アイオナは卵を盗まれ街を滅ぼそうとする不死鳥の怒りを鎮めた際、オードリムにおいて聖人として認められた。彼女が不死鳥を抱擁すると、その怒りは消え不死鳥自身も光の中へ姿を消した。それ以来アイオナは不死鳥の金色の光を身にまとい、彼女の智慧を求める全ての者に正義と慈悲を分け与えている。
CARD_0308_BODY;オストレゴスと彼の兄弟ジャルミーは、エオールの風の巨人の下からの唯一の生還者である。彼らは共にソラリスを統治していたが、ウロボロスを崇拝する派閥が勢いを得た際、オストレゴスは派閥を支持しその蛇の力を求めた。そしてオストレゴスとソラリスがウロボロスの瞳の忌まわしき光を浴びその姿を変えた後、ジャルミーはオストレゴスを未知の虚空へと追放し、シェータンを世界の遥か彼方へと消し去った。
CARD_0309_BODY;砂漠の商人は、望めば傭兵部隊を数隊編成できる程度には資産を持っているが、彼らはそうするよりもむしろ自ら弓を取る。ほとんどの者がこの見事に着飾った商人の実力を過小評価しているが、その見込み違いの分だけ、矢で心臓を射抜かれることになるだろう。
CARD_0350_BODY;伝説によれば、ジャルミーは彼に自らの知らないことを教えた者の願いを1つ叶えてくれるという。だが、その伝説は誤っている。1つではなく3つだ。
CARD_0352_BODY;ガイアの樹を手中に収めることに失敗した数年後、皇帝は「永遠の命の樹」が空の上で成長し続けていることを知った。そして彼は帝国の技術者を休むことなく働かせ、飛行船の艦隊を作り上げた。レディアンスはその中でも最も巨大で強力なものである。この艦隊を指揮する提督には、皇帝の最も古くからの友人、バノンが就任した。
CARD_0356_BODY;未だ世界に残り続ける神のほとんどは、自然の中に眠る良質のフェアリアに惹かれて残った利己的で飢えた存在である。自然を護るため、ドライアドの中には、森からフェアリアを盗み出そうと考える全ての神に警告するためゴッドハンターの役割を担う者も存在する。
CARD_0357_BODY;悪魔への対価として、血は唯一有効なものだ。戦いの最中で悪魔の手助けを欲するのであれば、あるいは新鮮な獲物を悪魔と分配したいのであれば、血を捧げる覚悟をしておいた方が良いだろう。
CARD_0362_BODY;神々の時代から今までで、世界がこれほどまで多くの運命の分かれ道、宿命の媒体に満ちていたことはない。誰もその前兆を知ることは叶わないが、創造の帰結は運命の天秤の上にあり、その目盛はたった一人の英雄あるいは奸雄によってどちらにも転びうるということは間違いない。
CARD_0366_BODY;司祭階級がウロボロスの祝福をシェータンへ行き渡らせ、彼らを強力に変異させている。遥か上空の闇の大地から、異形の同胞を戦争へと導くことが彼らの使命である。
CARD_0504_BODY;半生のほとんどを貴重な宝物を採掘するために費やした後、ゴキはちょっとした冒険のつもりで好奇心からおじのフーゴロについていき、偶然パンドラの中へ迷い込んでしまった。そうしてこの若きトライトンは、多くの物語と友人のためのいくつかの土産を手にし、冒険への熱意を大きく育てて戻ってきた。
CARD_0505_BODY;紺碧の空鯨は空鯨の中でも最も巨大な種族である。彼らはかつて非常に大きな群れでオーバースカイの雲々を飛び回っていた。身体に街全体を浮かべることが可能になるような浮遊性を持った鯨油を蓄えており、それを目当てに狩猟が行われるようになると、彼らは時とともにその数を減らしていった。更に皇帝は残った群れをスポーツ目的で狩り続け、今や生き残っているのはモービィのみである。
CARD_0507_BODY;マーナストにおいて最も長く生きる支配者カイオスは、この帝国に繁栄と科学的発展の新時代をもたらした。フェアリアを驚異的な技術の産物や壊滅的な決戦兵器のための燃料として用いることで、皇帝の崇拝者は彼らの外敵を全く寄せ付けない。
CARD_0509_BODY;一年に一つだけ、「永遠の命の樹」は極めて高濃度のフェアリアを含有する果実を実らせる。太古昔から、ラコア族の祈祷師がこの果実を収穫し、その力を雲海中に行き渡らせるための儀式に用いてきた。この雲から降る雨の滴がその降る場所全てに生命の開花と繁栄をもたらし、オーバースカイを他に比類なき楽園にしている。
CARD_0512_BODY;かつてはただの商人に過ぎなかったが、フーゴロはパンドラの扉を発見しただけでなく、それを開く方法をも見つけ出してしまった。その領域で目にした不思議の数々が彼の胸の中にけして消えることのない強欲の火を付けてしまい、彼はいつかパンドラの心臓部に到達しそこにある素晴らしい宝物を手にするという人生の目標を抱くようになった。
CARD_0516_BODY;かつてはただガラクタを集めるだけの機械であったCAP-10は、ある技術者により効率的に作業を進められるよう改造された。それから歯車が狂っていった。今、CAP-10は世界中の空を股にかけ、嬉々として略奪を繰り返しつつ、見つけたあらゆるガラクタを用いて自身を強化し続けている。
CARD_0519_BODY;ウロボロスが目覚め、その煌々と輝く瞳を開閉することで世界に昼と夜をもたらす以前、世界はイスタヌとその子達の放つ光に満ちていた。その蛇が目覚めた際、そうした光の精霊の多くが瞳の放つ熱と悪意から逃れるため天上へと昇り星となり、イスタヌだけが地上へ残った。
CARD_0521_BODY;皇帝がオーバースカイを侵略し始めた時、ラコア族は彼らの持てる技術の全てを戦いのために用いなければならなかった。驚くべきことに、このウラニの領域に住むカエル飼いは、極めて効果的な戦力となった。毒を持つカエルを優れた射程と精度をもって投擲することができたからである。
CARD_0532_BODY;「永遠の命の樹」の多くの番人や神職者のうちでも、ウラニは最もひたむきで献身的な祈祷師であった。下界からオーバースカイへ侵略者がやってきた時、ラコア族の民はウラニに教えと導きを仰いだが、彼女の能力と意志をもってしても皇帝が樹を汚すのを止めることはできなかった。
CARD_0601_BODY;かつては喜びと笑顔に満ちた美しい乙女として知られていた。遥か昔に彼女の気を引こうとした意地の悪い精霊に我が子を殺され、亡骸だけがその魂を探して深く茂った森や空の上を徘徊し続けている。
CARD_0602_BODY;ケルドランの達人に鍛えられたこの精鋭達は、皇帝の自慢の部隊であり、彼のオーバースカイを制覇する野望のための手駒である。今、カイオスの汚染はこの兵士にも及び、彼らは慈悲も良心も無く、皇帝の名の下空の粛清を担っている。
CARD_0603_BODY;このオーバースカイの倒錯したサルは、常に濃密なフェアリアへの渇きを覚えている。一口飲むたび彼らの利口な精神は閃きに満たされていたが、今、その渇きは彼らに悪夢のような感情を抱かせ、暴力的な行動へと駆り立てている。
CARD_0604_BODY;皇帝の汚染の意志に支配され、この兵士たちは疲れを知らずものも言わぬ人形になり果てた。心持たぬ帝国の軍団は、休息も大義も必要としないまま征服のみを求めて進軍する。全ては敵であり、全ては獲物である。
CARD_0605_BODY;帝国の一団がオーバースカイに到着した際、その中にはマーナスト技術アカデミーの会員も多く含まれていた。この探検家達は浮遊する島について調査し、将来的な利用のためにその力の源を体系化することに熱意を抱いていた。しかし汚染が広まると、彼らは発見への情熱を捨て、自らの見つけたものを利用することのみ追い求めるようになった。
CARD_0606_BODY;かつては皇帝に近衛として付き従う名誉ある騎士であったが、友軍と敵とを区別なく倒すことに囚われた怒れる奴隷になり果てた。彼らの剣に宿る魔術を汚すものと同じ力が、彼らがかつて体現していた気高き精神をも汚染してしまった。
CARD_0607_BODY;闇をまといささやきよりも静かなシャドウシルクの妖精は、生まれながらのスパイである。彼らは影から影へと飛び移り、妖精の兄弟姉妹達との情報共有のため帰還するまで、世界に起きる全ての出来事を監視し続ける。
CARD_0608_BODY;「永遠の命の果実」の作用は、摂取者の心の最も奥底にある本能を最大限鮮明な形ではっきりと現し、他の全てをその力で焼き尽くしてしまうことであるといわれている。かつては力と征服への抑えきれない欲望を抱えたただの人間であったこの皇帝は、力と征服そのものの権化へと姿を変えてしまった。
CARD_0609_BODY;「永遠の命の樹」の崩壊により、自然の秩序は日を追うごとに汚染されていく。草木は萎れ、水は毒を孕み、魚たちは空から堕ちた。オーバースカイが死と怪物以外存在しない土地になってしまうのも、もはや時間の問題だ。
