CARD_0610_BODY;オーバースカイのピラニアは、かつては血の臭いが珍しいものであったため、どんなかすかな痕跡をも遠く離れた場所から嗅ぎ付けることができる。そしてあらゆる場所に死の臭いが立ち込める今、彼らは彼らが餌とする死体と同じくらいありふれた存在になっている。
CARD_0611_BODY;オーバースカイそのものよりも古くから生きるこのヒドラは、サイリアの巨人によって石と魔術の牢獄に囚われたウロボロスの落とし子である。カイオスによる汚染のため牢獄の力は今や弱まり、この最も強力で邪悪なヒドラはそこを抜け出して再び大地を破壊し尽くしている。
CARD_0612_BODY;吾が一人　彷徨う森に\n在りし壁　根蔦蔓延る\n覆う闇　冷たく厚く\n葉と枝は　紫に病む\n静寂に　音立つ刹那\n巧みなる　柳が計に　吾が命散る
CARD_0613_BODY;この猪から漂う甘ったるい腐敗臭には、不思議な酩酊作用がある。この臭いは蝿や蛆の大群だけではなく、死や腐敗そのものを捕食する、より大きな生物をも惹きつける。
CARD_0614_BODY;ラコア族の伝承によれば、この化け猫は深い森の中に棲み、彼らの暗い縄張りに足を踏み入れたものを狩り、貪ろうとしているという。今や、この神話の中のクリーチャーはねぐらから這い出し、彼らがかつて故郷と呼んだ手つかずの森が汚される度に大きさと邪悪さを増している。
CARD_0615_BODY;かつてはパンドラで最も偉大な鍛冶師だったが、下級の神々の玩具を次から次へと作らされたことに憤りを抱いていた。秘密裏に彼は自身の最高傑作である破壊の鉄槌を鍛え、それを用いて夢の領域と現の世界を隔てる障壁を打ち砕いた。現在その裂け目は魔法の扉によって封印されており、彼は荒れ果てた山を歩き回りながらその裂け目を通ろうとするものに襲い掛かる。
CARD_0616_BODY;憎しみと怒りの精霊であり、血と血の等価交換を持ちかける。
CARD_0617_BODY;カイオスによる汚染が始まると、オーバースカイはその平和な番人たちに牙をむいた。空そのものの痛みや怒りがラコア族全体に向けられ、炎が農園や森などを焼き尽くした。
CARD_0618_BODY;オーバースカイの汚染はこのサーモンが棲み処とする雲や風の流れによって急速に広がっていき、サーモン達はまず自らの身体を今までよりも暗いものに変化させていった。今や彼らは自分の身や種の存続すら顧みず、神々の聖髄のみを探し求めている。
CARD_0619_BODY;死は終わりを意味しない。我らは次の目覚めをいつとも知らぬまま、夢のうちに生きるだけだ。- 空の天才 カリム
CARD_0620_BODY;ウロボロスの火に触れ新たな生命を作り出す能力を得て追放されて以来、オストレゴスは多くの子を創造してきたが、その中でもソレムほど卑劣なものは他にない。巨人と妖精の血を半分ずつ引くソレムは、父の力と母の狡猾さを併せ持ち、世界の破壊を助長し父を自由にするという目的のため、その両方を行使している。
CARD_0622_BODY;それらを必要とする全てのクリーチャーに毛と乳と絆の心を与え、草原に平和な繁栄をもたらすため、ガイアによって創造されたクリーチャーを伝えた伝説がある。今、彼女の子供たちに迫る危機に備え、戦うために育てられたヤクの軍勢を引き連れて母なるヤクは帰還した。
CARD_0623_BODY;どんな戦いにおいても、ヒーロー達は挑戦のために立ち上がるだろう。彼らは人々に全ての困難と戦う勇気を与え、また同様に人々が彼らに見出す希望に力を貰っているのだ。
CARD_0624_BODY;皇帝への献上品として、一匹のフグが狩られ調理されたことがあった。皇帝は非常にそれを気に入り、毎晩の宴にフグを出すように求めた。その後数ヶ月のうちに、このフグは帝国の貴族の腹を満たすために絶滅の危機に瀕していた。
CARD_0625_BODY;やあ友よ。伝承の頁でおしゃべりしてるっていうのはちょっと変かな？え、待ってよ！ボクのヒミツをバラそうっての?!?!
CARD_0626_BODY;サファイアヤクは群れの指導者となるため、母なるヤクより生を受けた。フェアリアに秘められた力を、全てのヤク族と共有するために。
CARD_0627_BODY;馴染みのない臭い。侵入者だ。単独か。弱い。独りだ。夜になるまで跡をつけろ。よく見ろ。待て。やれ！刃の痛み。肉の味。侵入者が逃げる。追え。逃がさない。血の臭い。牙が深く突き刺さる。血の味。侵入者はもう動かない。勝利の雄叫び。いい狩りだった。
CARD_0628_BODY;エメラルドヤクは群れの世話役となるため、母なるヤクより生を受けた。次なる世代のジェムヤクが、無事に育つまで保護するために。
CARD_0629_BODY;世界を破壊しようとするウロボロスを止めるためガイアが彼女自身の身を捧げた時、3つの種がその光に触れ偉大な力を吹き込まれた。そのうちの1つを見つけた花の精霊は、種を神々の下へ還すべく空へと登った。しかし彼女は何も見つけることができないままに眠りに就くことになり、眠る彼女の胸の内で芽吹いた種が「永遠の命の樹」へと成長した。
CARD_0630_BODY;俗説とは異なり、溶岩波のサンショウウオは火山に生息しているわけではない。彼らの周囲の溶岩流は、巨像をも融かすほどに高温の彼らの分泌物に、長期に渡って地表が曝されたことで生じたものである。
CARD_0640_BODY;ラコア族の民は優秀な職人であったため、その才能をすぐに戦争のための兵器に活かすことができた。ラコアコプターは、既に空へと飛び上がり、炎で皇帝による汚染を浄化している。
CARD_0641_BODY;ルビーヤクは群れの盾となるため、母なるヤクより生を受けた。母の子らを傷つける、あらゆる者を粛正するために。
CARD_0642_BODY;遥か昔、神々や巨人が世界を形作る際、彼らを援けた竜の群れがあった。しかしながら、見通しの甘さから、神々はこの竜たちに繁殖する能力を与えなかった。今、その竜たちの霊は、生きるもの全ての脅威となっている。
CARD_0643_BODY;普段はおとなしく、餌を探して漂っているが、脅威を感じると、空鯨を倒すほどの猛毒で徐々にそのトゲを満たし、極めて危険な生き物へと姿を変える。
CARD_0644_BODY;トパーズヤクは群れの眼となるため、母なるヤクより生を受けた。平時には緑の牧草地で食糧を探し回っていたが、今、彼らは群れの敵を踏みつけながら進軍している。
CARD_0645_BODY;ラコア族の民は優秀な職人であったため、その才能をすぐに戦争のための兵器に活かすことができた。ラコア族の戦闘機関とよく訓練された乗組員は、鋼で造られ蒸気で動く心を持たぬ帝国製の機械と既に渡り合えるようになっている。
CARD_0646_BODY;ラコア族の全ての民は、時には大義のために自己犠牲が必要なことを知っている。その考えを極端に危険な意味に解釈する者もいるが、誰もこの大砲と狂気に満ちた目を抱えるラコア族を止めようとは思えないだろう。
CARD_0647_BODY;かつてはちょっとした集会を魔法のような驚きに満ちたイベントに変えてしまうような、ラコア族の中で尊敬される素晴らしいエンターテイナーだった。今、彼らはその才能をより危険な、それでいてなお驚くべき魔術として用いている。
CARD_0648_BODY;私は妹たちの傍に立ち、弟たちを守り抜く。私は人々を守る盾であり、たとえ倒れようともすぐ他の盾が後を継ぐだろう。 - 盾兵達の誓い
CARD_0649_BODY;戦渦がオーバースカイの各地に広がるにつれて、かつて暴力的な振る舞いをしたために村を追いやられた者たちが立ち上がり、平和を愛する同胞たちに、彼らの故郷と命のため戦う術を教えるようになった。
CARD_0650_BODY;ラコア族の村はオーバースカイの島々のいたるところにあり、新たな戦争のために募兵官が村へやってくるまで、ラコア族のほとんどはカイオスが「永遠の命の樹」にしたことを耳にしていなかった。
CARD_0531_BODY;オーバースカイ全域にわたって、百万を超える種のアネモネが空に咲いている。ラコア族はそのたくさんの色を、空鯨たちはアネモネの産み出すご馳走を、ヤクたちは憩いの場を求めるときに絡み合ったアネモネの柔らかさを楽しんでいる。侵略を続ける帝国はアネモネがそんなに素晴らしいものであるとは思わなかった。アネモネはよく飛行船のタービンに詰まったり、戦闘真っただ中の血気盛んなドレイクライダーたちを絡め取ったりしたからだ。アネモネの根絶令を出した皇帝でさえも、思い通りにはいかなかった。アネモネは切り刻まれたどの蔓からも、容易に全体を再生することができるからだ。
CARD_0527_BODY;オーバースカイの水晶平原を注意深く探せば、夢の詰まった石の陰に、亀の卵が隠された場所を見つけることが出来るかもしれない。それらの卵が孵る時、その宝石は孵った亀の殻の中に埋め込まれ、千の夜の夢が亀の背中できらめく間、大きさと力を共に成長させ続ける。
CARD_0526_BODY;パンドラと現世の間の壁は常に絶対的なものであるわけではない。時には夢がこちらに漏れ出し、フェアリアで満たされた水晶と結合することもある。夢の護り手はそうした夢を熱心に収集していて、長きに渡る死の眠りと生き続けることの両方に思いをはせることに魅了されている。
CARD_0367_BODY;破壊の時代の間に、多くの神々がウロボロスからフェアリアの世界を守るために自らの力を手放すことになったが、力を保ち続ける道を選んだ神も存在した。彼らは能動的な方法の代わりに、ただ誓うことで自らの創造物を破壊を企てるものの手から護ることにしたのである。
CARD_0335_BODY;メルージルの狩人は、100歩の距離から一石を以て鹿を仕留められるほどの優れた狩人であるという評価を常々受けていた。彼らが糧とする森を切り倒す命に逆らった咎を受け帝国が彼らの村を瓦礫と灰に変えた後も、彼らは狩りを続けていた。鹿や兎に替わり、現在の彼らの獲物は帝国の隊商と収税官だ。
CARD_0316_BODY;シェータンが訪れる前、不死鳥を南方の砂漠で見かけるのは珍しいことではなかった。そしてこの悪魔達はすぐに、彼らの心の炎をその偉大なる生物に植え付け、狂乱に導くことができると知った。かつて不死鳥であったその亡霊は今、世界を蹂躙し混沌と破壊をもたらしており、シェータンがその残骸を狂喜して漁り回っている。
CARD_0315_BODY;霊魂に本当の意味での死が訪れることはなく、彼らは自然界のフェアリアの循環を通して再循環と再誕を繰り返している。しかし、時にその自然の法則が恐ろしく狂ってしまい、ある霊魂が生と死の狭間に取り残されてしまうことがある。水路をせき止める流木のように、その霊魂のもとに他の失われた魂が流れ着き、過去に類を見ない怪物へと姿を変えて世界に恐怖と死をもたらすことになるだろう。
CARD_0314_BODY;もしもあなたが炎と樹が共存する場所を歩くような時には、クラックソーンの叫びに気をつけろ。火花と灰の中から生まれ、種と蔓に囲まれて育ったこの生命は、破壊と焼尽の怒りに駆り立てられながら、哀嘆と惨禍に暮れているという矛盾した存在である。その空を裂く雷が木々と石を打ち砕くような嘆きの声を聴いてしまったのであれば、とにかく逃げるのが得策だ。奴があなたの、その身と骨を裂くことのないように。
CARD_0313_BODY;共に生まれ、けして離れぬ二体の精霊。空間の隔たりが彼らを分かつ時であっても、彼らの魂は一つであり、彼らの心は完全な調和の中にあり、彼らは常に同じ目的を共有している。その完全な絆の強さは、例え我々がその美しさに憧れ、一生涯を費やして志したとしても、けして手の届くような範疇にはない。
CARD_0312_BODY;世界の中心部、熱く照り付けるウロボロスの瞳から遠く離れた場所は、厳しい寒さの襲う土地であり、その風景は目まぐるしく移り変わる。氷河と流動する溶岩の河が激しくぶつかり合う傍ら、氷と岩の下に古代の驚異が息づいている。このベヒモスはかつてこの地に眠る宝物の守護者であったが、今の彼らは、永遠の冬の命を脅かす冷気から生き延びるため、あらゆる熱源を貪りつつ彷徨う獣に過ぎない。
CARD_0311_BODY;これまでの旅を通して一度だけ、私は命の危険を感じたことがある。沼地の道すがら、私は正真正銘の、燦然たる捕食者と出会った。奴は私を獲物としか見ておらず、私の弱さのみを嗅ぎ付け、肉への飢えだけを感じており、私を狩ること以外頭に無いようだった。戦っては勝てるはずもなく、私は遠くへと駆け出し、隠れることにした。再び奴が私を見つけると、私はとにかく逃げ、逃げて、逃げた。私が命の危険を感じたのはその一度だけだが、その時の恐怖はまだ消えていない。奴はまだ狩りの途中で、私は今も獲物のままなのだ。
CARD_0199_BODY;悪魔たちは世界の果て、ウロボロスの燃え盛る瞳によって荒れ果てた焦土と化した、彼らの故郷に住んでいる。最も弱き者は手の届きうるものを喰らい、強き者は自分より弱き者を喰らうものだが、その例外は嫌悪の種だ。忌々しく妬みに満ちたウロボロスの炎から生まれたこの悪魔たちは、彼らのうちで最も強く悪意に満ちた仲間に付き従う。彼らはその忌まわしき太陽の憎悪と軽蔑で獲物を打ち据える時まで、獲物が最も弱り、自らが最も強くなる瞬間を待ち続ける。
CARD_0135_BODY;ティキ族の若者たちは、彼らの村のそばに住む友好的な動物の世話をする。大人たちは、必要に応じて獰猛な獣たちを手助けするため、深き森の手つかずの場所まで駆けつける。そして本当に古くから生きる者たちは、意図して動物を探そうとはしない。彼らは本当の調和というものが、自然のなるがままに任せることで生まれるものだということを知っているからだ。
CARD_0109_BODY;エレメンタルははじめ、ウロボロスが旋回によって期せずして残したエネルギーの渦から誕生し、その後元素の神々によって生命として形作られ、統制されるようになった。かつてアルアに祝福されたギャブリアの民はエレメンタルを召喚し、使役し、更には新たな水のエレメンタルを創造して彼らの孤立した王国の兵や僕とする方法までもを見つけ出した。
CARD_0085_BODY;数々の生命が旧世界の終焉を告げる天変地異の間に命を落とし、粉々に砕けた残骸だけがその場に残された。この精霊達は新世界での形と意味を求め、古びた都市の遺跡を彷徨っている。彼らに偶然出会ってしまった不運な者は、彼らの苦痛と苦悩が絡み合ったような姿に変えられてしまう。
CARD_0048_BODY;サイランドの長老たちはとても長命であり、その辛苦に満ちた人生は彼らから力を奪い、知恵を与えた。彼らは若い世代へ自らの知恵を受け継ぐことに尽力している。純真な若者たちが偉大なる冒険の夢を抱きつつ、不可欠な草原での労働から逃れようとしているとしても。
CARD_0044_BODY;サイランドの人々は、たびたび残酷な蛮族の襲撃を受けて飢饉に追いやられることがある。自らの土地が焼き払われ略奪を受ける様を石の壁の陰から目にするとき、彼らはその先に厳しい冬が待っていることを知るのだ。
CARD_0039_BODY;さあ、お話をしよう！\n見込みのないヒーローのお話を。\n故郷サイランドを遠く離れないといけなかった旅人のことを。\n冒険と、幸福と、高貴な目的に満ちた生活を求めた少女のことを。\n\nさあみんな、聞いてごらん！\n彼女の出会った不思議の全て、立ち向かった怪物たちのことを。\n彼女の乗る忠実な相棒、サイランド平原生まれの気高きヤクのことを。\n彼女が得た技や力で今も振るう、母から受け継いだ剣のことを。\nいつの日にか、家族とふるさとを脅かす巨悪を打ち倒す少女のお話を。
CARD_0014_BODY;シャーラーがテスラに深手を受けた際、彼女の師はシャーラーを人里離れた修道院に連れて行き、傷が癒えるまで毎日神秘の歌を聞かせ続けた。彼女が歌について尋ねると、その歌は彼が遥か昔にティキ族から盗み取った秘密の歌であるということと、他にも沢山の力を秘めた歌を彼は知っており、いつかシャーラーにもそれらの歌を伝えるつもりであるということを教えてくれた。
CARD_0671_BODY;カミナリウナギは非常に珍しい生物であり、彼らの浮き漂う卵に稲妻が炸裂した強大な力によってのみ誕生する。ラコア族の先祖がこのウナギを嵐の神であると考えて信仰し、希少な金属を供えていたことが知られている。
CARD_0670_BODY;ラコア族はしばしば「永遠の命の樹」から生まれた植物を植え、奉納のための神殿をその周辺に建てていた。そこに博愛と成長をもたらす慈悲深き精霊が住み着き、周辺のラコア族の手助けを行うこともあった。だが、「永遠の命」が汚染された時その樹は枯れ果て、命を失った骸に姿を変えてしまった。今は闇の精霊がそこに住まい、かつて神殿から恵みを享受していたラコア族に苦悶を与えることを喜びとしている。
CARD_0669_BODY;戦争から利益を生み出す方法は多くある。兵器を両方の陣営に売る者もいれば、裏切りの説得を受けて多額の賄賂を受け取る者もおり、その一方で輝きや光を放つものを求め、戦場を漁り回るものもいる。鳥たちは富を求めているわけではないが、ウロボロスの瞳の血を帯びた輝きの中でも繁殖を続けるために十分な肉と腸を探し求めている。
CARD_0668_BODY;汚染がオーバースカイに拡がると、様々な植物や動物が最初にその影響を受けた。しかし更に汚染が進むにつれて、その影響はより深くまで及ぶことになり、土地に住まう多くの精霊をも歪めてしまった。かつてはエレメンタルが守護していた砂地の中の区画で、今の彼は目に映る全てから命を搾り取り、肥沃な谷を塵の積もった砂漠へと変えることだけを望んでいる。
CARD_0667_BODY;原始の精霊が花弁を開く花から、あるいは新生児の産声から生まれたのと同じように、闇の精霊は死、疫病、破滅と共に現れる。その中でも最も穢れた者の一つが、邪より生まれし精霊である。彼らは凄まじい恐怖に苛まれて命を落とした者の断末魔に引き寄せられその死相を自らの物とし、彼らの名の下に更なる惨劇を引き起こし続ける。
CARD_0666_BODY;我々は最初、それを任務を完了するために戻ってきた帝国の飛行船の音と影だと思っていた。だがその時、我々の仲間の一人が、奇妙で巨大な虫が空から降りてくる、と悲鳴交じりで警告した。我々は皆可能な限り迅速に逃げ、私は夢中で逃げた。数時間の後に我々が戻ると、そこには虫の卵で膨れ上がった仲間たちの死体があった。我々が見つけた死体のすべてを焼くよりも速く、すぐに幼虫が卵の中で蠢き始めた。
CARD_0665_BODY;戦争はかつては肥沃であったオーバースカイの島々にその代償をもたらし、帝国の兵士が占領していた荒廃した土地と、広大な不毛の大地が残されている。多くの野生生物が生き延びるためにもがいている一方で、ネズミなどの中には、その環境下で大きく数を増やすものもいた。捕食者だらけの荒野で食料を探し求めるよりも、帝国の兵士が残したものを食べ漁る方が遥かに幸福な方法であった。
CARD_0664_BODY;忘るる勿れ 燻る残り火 撥ぬる火花の 皆飢えり\n其の身燃ゆるを 望まぬならば 傍らに置き 確と抱け\n木端に切枝 ばかりを焚べよ 野辺に黒木を 与ふるな\n燃ゆる一火を 軽むべからず 汝が身を焼くに 足ると知れ
CARD_0663_BODY;記録にもないような太古の昔から、それが自らの破滅を招くとしても、偉大なる力にひれ伏す者は存在した。イグナスを心から信仰する者たちは、その中でも最も自己破壊的であり、あるじに栄光をもたらすためであれば喜んで世界をその火に掛けるだろう。彼らは皇帝の起こす戦争が炎と灰以外の何も残さないことを信じ、彼の旗の下に集った。
CARD_0662_BODY;イグナスが生まれた時、そこには消えることのない栄光の炎がただあるのみであった。この偉大なるエレメンタルは、その炎への回帰をただ願っている。たとえその炎が一度放った火花が、その周りの世界すべてを焼き尽くしてしまうとしても。
CARD_0661_BODY;このコボルトは戦争が彼らの帝国から遠く離れて起きたことを大いに喜んでおり、その戦いの火をあおるためには手段を選ばなかった。彼らがよく使ったやり口は、両陣営の拠点それぞれに悪魔を入れた樽を運び込むだけで死と大混乱をもたらすというものである。
CARD_0660_BODY;オーバースカイの住民と帝国との間に起こった大きな戦争については誰もが知っている。その壮大な機械対自然の戦いのことを。一方で、Ro88Eと川のそばの洞窟に住む貧相な熊との闘いについて知っている者はほとんどいない。しかし彼らが引き起こしたことを考えれば、この闘いもまた同じくらいの重要性を持っている。
CARD_0659_BODY;戦争の間、ラコア族はこのカバにフェアリアを含んだ穀物を与え、敵の兵士たちの中へ走りこませるという戦術をとっていた。このカバはフェアリアによって非常に不安定な状態になり、帝国の兵士を踏みつける時に大きな爆発を発生させるのである。
CARD_0658_BODY;その船が雲の中から出てきた時、私たちはその船首をウロボロスの光が横切るのを恐ろしく思いながら見上げていた。直後、雷のような音が鳴り響き、100発ものミサイルが私たちの上に降り注いだ。私は逃げ、隠れ、次から次へと押し寄せる爆撃の波から何とか身を守ろうとした。どうやって私が生き残れたのかは分からないが、瓦礫から体を引っ張り出した時には、村で生き残っているのはもう私だけだった。 - ラコア族の農家、プラウドテール
CARD_0657_BODY;快活なる愛すべき船員たちを乗せて12の空を飛び回るガガナーは、サイランドのファームボーイが夢見ることすら出来ないような冒険を経験し、オローセイですら信じないような不思議を目にし、そして皇帝すらも驚かせるような宝物を集めてきた。だが彼らは、あらゆる物の内でも最も偉大な冒険のためであれば、手にした何もかもを喜んで置いていくだろう。つまりそれは、世界を救うという冒険だ。
