CARD_0106_BODY;…ウロボロスがアルアを一口で呑んでしまおうとしたちょうどその時、アルアはウロボロスのしっぽに駆け上がりました。すると辺りにものすごい雷が鳴り、稲妻が光って、ウロボロスはアルアと自分のしっぽの両方を呑み込んでしまったのです。こうして、この偉い女神さまはウロボロスをだまして自分のしっぽを食べさせ、この大蛇が残った世界の何もかもを食べてしまうことを防いだのでした。さあさあ、みんなもう寝る時間だ！おじいさんはもう疲れたよ。
CARD_0086_BODY;トライトンシェフが働く姿を見れば、あなたは彼らが料理の芸術を極めようとしているのだと信じて疑わなくなるだろう。魔法のパケンピンでとれた大きな果物を下ごしらえして焼き上げるためには、最高水準の調理技術と不屈の精神が必要だ。未熟なシェフは、料理が完成するまで食べるのを我慢することができないのだ。
CARD_0062_BODY;マーナストでは、フェアリアは最も価値のある資源である。多くのマーナストの若者が、聖なる森のドライアドからフェアリアを盗み出そうとしてその身を危険に晒す。帰ってくるものはほとんど居ないが、数少ない生還者は、他の世代が同じことを試みたくなるほどの富と名声を得ることができる。
CARD_0061_BODY;マーナスト帝国の現状に異議を唱える者は、誰であっても罪人の烙印を押され、都市のもたらす快適さと安全から追い立てられる。無法者はすぐに反逆者へと変わり、反逆者はすぐに賞金首となるのである。
CARD_0054_BODY;いつの時代も、富と名声のために自らの若さと活力を捧げる男女は後を絶たない。悲しいことに、勇敢さや向こう見ずさは知恵や技術の代わりにはならないということを、彼らは手遅れになってから知るのである。
CARD_0045_BODY;マーロバルでは、国王マグナスがいがみ合う貴族階級の仲介を行い、王家の裁判官が一般市民の裁判を担当しているとされている。しかし王国の内情に詳しい者は、女王マグダーが自らの目的のために上下両方の法廷を操っていることを知っている。
CARD_0032_BODY;普段は愛らしく従順だが、激昂したヤクのそれよりも激しい怒りはこの世に存在しない。
CARD_0009_BODY;帝国の成立する以前から今まで、マーナスト技術アカデミーはフェアリアを燃料とする機械や端末を止めたことがない。
