FUGORO_EPIC_02_0001;Ho acquisito nuovi tesori.
FUGORO_EPIC_02_0002;Si dice che questa statua vivente fosse la sorella di Orosei.
FUGORO_EPIC_02_0003;Sario, il Sommo Sacerdote, si è divertito infinitamente con le sue vittime. Letteralmente all'infinito.
FUGORO_EPIC_02_0004;Questo vince la gara annuale di Costruisci uno Sconquassatore migliore!
FUGORO_EPIC_02_0005;Ho dovuto intrufolarmi nella montagna di Garudan per questo gioiellino.
FUGORO_EPIC_02_0006;Il Re pazzo ha creato un'intera armata di Yak Meccanici.
FUGORO_EPIC_02_0007;Questa pergamena è stata scritta da un monaco senza nome. Lo chiamerò Jerry.
FUGORO_EPIC_02_0008;Il Calice col Salice contiene un'infusione di precisione.
