CARD_0368_BODY;The commands of the Emperor come in scrolls of black vellum, tied with a purple silk ribbon. The command is written in his own hand in gold ink, his seal pressed into crimson wax. Though no magic binds the subject of the command, only the greatest enemies of the Emperor would ever dare to disobey.
CARD_0358_BODY;Close to the edge of the world, the fires of Ouroboros' eye do not fall evenly on the land. Those who catch the attention of the Burning Eye suffer greatly, but those who learn how to direct its attention can lay waste to their enemies.
CARD_0355_BODY;When the tree that a kodama is bound to dies, usually the kodama wastes away soon after. A rare few, however, will become wild and hungry things, focused only on the destruction of those who harm the forest.
CARD_0354_BODY;While these creatures usually eat dreams, it is not difficult for them to consume the occasional god. For what are gods but imagination fused with purpose, possibility mixed with execution, dreams given form.
CARD_0319_BODY;When the first king of Meroval, Himsaël, came back from his expedition around the known world, he founded the famous royal academy of explorers, settlers, and cartographers. To this day they still create the most detailed maps in the world.
CARD_0302_BODY;These giant, mutant monstrosities are ancient shaytan who must constantly consume souls in order to survive. Thankfully, you will only ever need to witness any these abominations once in your lifetime: Right before you die.
CARD_0298_BODY;You cannot see them in the night. During the day, they hide in your shadow. The deadliest things are not large and fierce. The deadliest things are in the quiet.
CARD_0294_BODY;Before Ouroboros awoke and attempted to swallow the world, the giants of wind would keep every sort of bird within these golden aviaries. Though much faded, the magic of these places still remains.
CARD_0293_BODY;If you wish the aid of the wind, you have to embrace its impulsive nature. To be the friend of the wind, you must first be a friend to it. - Khalim
CARD_0290_BODY;The faeries are tiny but powerful spirits who would follow the four elemental gods wherever they went. Without the light of their god to follow, the sunsilks wandered without purpose until the solars gathered them into their cities. This gave them a new purpose and a new home.
CARD_0278_BODY;Only the keldrans are able to train and ride the Dune Drakes, and even amongst them a master drake rider is highly respected. They are the elite of keldrans, deadly mercenaries that are paid a fortune by the richest Amai Trade Princes.
CARD_0257_BODY;A true master of the wind never walks.
CARD_0255_BODY;In any battle against a corrupt god, it is the sagittarius who strike first. While letting loose a storm of arrows to soften up the opposition, they inspire their allies to fight their hardest against those that would misuse the sacred essence of the world.
CARD_0246_BODY;These crumbling relics used to be among the deadliest weapons deployed during the War of Giants. While they are perpetually on the verge of becoming lifeless piles of stone, many have somehow outlasted the giants that made them.
CARD_0244_BODY;How could they let Aoros die? How can mortals still pray the other Gods? Astar was weak, Alua did nothing, Gaea only cared for her precious trees... And now they are laughing? How can they cheer and feast while the greatest of the Gods is dead?! They will pay for their lack of respect! - Garudan.
CARD_0237_BODY;Rumble and trouble. Quake and break. Praise to the thunderwalker, the boomstep, the groundshaker.
CARD_0234_BODY;The faeries are tiny but powerful spirits who would follow the four elemental gods wherever they went. Since the death of Aoros, the flamesilks instinctively flock around any large source of flame, drawn to it like they once were drawn to their patron.
CARD_0226_BODY;These mecha are unusually excitable. While quite able to concentrate their flames into a focused beam, they often spray their fire everywhere at the first moment of ignition. What was supposed to be a nice cooking fire or a welded pipe can end up with half the town being burnt down.
CARD_0224_BODY;The mechas use a system of high-speed railcars to transfer goods and weapons between the principal cities within their lands. In more remote areas, or during one of their frequent invasions, they must rely on strong carrier mechas to bring in armaments and munitions.
CARD_0223_BODY;For creatures crafted with such meticulous care, every gear and piston a testament to perfect craftsmanship, mechas sure enjoy destroying things.
CARD_0196_BODY;During the height of their Empire, the kobolds built impregnable fortresses that spread out through tunnels, vaults, and caverns across the entire world. Their walls and gates would have never fallen by outside force, but were easily brought to ruin by internal strife and rebellion.
CARD_0181_BODY;In the center of the world lays the magical Valsîrion. Here the gods forged the world from mighty vortexes of elemental energy. Anything can be crafted or transformed here with a strong will and plenty of faeria to fuel the forges of creation.
CARD_0180_BODY;The mysterious weeping idols can be found throughout the rainforests around the Gaea Tree. While there are many tales and legends about where they come from, only a few know the truth: They were the children of Gaea who turned to stone when the goddess sacrificed herself. Now they weep not only for her death, but for the loss of every living thing.
CARD_0176_BODY;While all tikis worship sacred animals and honor Ruunin especially, a select few have sworn themselves fully to her cause of defending the woodlands. They ride on the backs of blessed wolves, scouting the borders of the wild, warning the Green Alliance of any threat they find.
CARD_0171_BODY;The faeries are tiny but powerful spirits who would follow the four elemental gods wherever they went. Without Gaea to guide them, the flowersilks live anywhere with large amounts of life essence. While this is most commonly areas with large and ancient trees, they have been known to trail after large beasts and even especially virile humans.
CARD_0157_BODY;Faeria exists all around, in every object and every living thing. However, like water, faeria also flows and collects into pools and lakes. And, like water, trees with hungry roots will suck up every drop and become holy bearers of divine energy to some, or living beacons of power and wealth to others.
CARD_0155_BODY;Ruunin has been the protector of the tiki tribes for thousands of years, but she can't be everywhere at once. In times of despair, the shamans gather around her shrines and call for her aid. They hope for her protection, but sometimes she can only offer her spirit.
CARD_0128_BODY;While it takes grandiose visions to sway the minds of the strong, those weak of will can be controlled with a daydream, a word, or even a simple trick.
CARD_0126_BODY;When the goddess of water Alua created the gabrians, she gave them the sacred task of shaping and caring for the ocean. The Wavecrafters took this duty very seriously, even going so far as to fuse their bodies with elementals of water to better control the waves and tides.
CARD_0117_BODY;In the lost temples of the ancient world, one can sometimes find strange, pulsating eggs. What might hatch from them, no one knows. Just in case it is a dragon or some evil monster, people tend to build their villages far from wherever these eggs might be found.
CARD_0116_BODY;Often mistaken for ghosts or spirits, luduans were actually once people who became so addicted to faeria that it became all they ate and drink.
CARD_0110_BODY;The faeries are tiny but powerful spirits who would follow the four elemental gods wherever they went. The gemsilks used to wander aimlessly around lakes or over the oceans, but have recently begun to congregate above the waters of Gabria.
CARD_0106_BODY;... And then Alua ran right up the old snake's tail just as Ouroboros closed its jaws around her, swallowing both with a crash of light and thunder. That is how our great goddess tricked Ouroboros into swallowing its own tail so it couldn't finish eating the rest of the world. Now, now. Everybody to bed! Grandpa is tired.
CARD_0086_BODY;When you watch a triton chef working, you can have no doubt in your mind that they practice the pure art of cookery.  Roasting and preparing the giant fruits of the magical Puken'pin requires the highest level of mental fortitude and culinary skill, for lesser chefs cannot resist eating them before they are fully cooked.
CARD_0062_BODY;There is no more valuable resource in Mîrnast than faeria. Many young Mîrnasters risk everything to steal faeria from the dryads of the Sacred Forest. Few return, but those who do gain wealth and fame enough to inspire another generation to make the attempt.
CARD_0061_BODY;Anyone who opposed the status quo of the Mîrnast Empire was branded a criminal and cast out from the safety and luxury of the cities. Outlaws quickly become rebels, and rebels quickly earn a price upon their heads.
CARD_0054_BODY;In every age, there will always be men and women risking their youth and vigor for fame and fortune. Sadly, they often learn too late that bravery and daring is a poor substitute for wisdom and skill.
CARD_0045_BODY;In Meroval, King Magnus is said to mediate between feuding nobles while the royal judges handle justice for common citizens. However, insiders in the kingdom know that it is Queen Magda that manipulates both the high and low courts to her own ends.
CARD_0032_BODY;While normally docile and lovable, there is no greater fury in this world than that of a yak enraged.
CARD_0009_BODY;Since even before the days of the Empire, the Mîrnast academy of engineering has never stopped improving their faeria-fuelled machines and devices.
