CARD_0642_BODY;In ages past there used to be multitudes of dragons, who aided the gods and giants in the shaping of the world. However, lacking foresight, the gods did not give dragons the ability to breed. Now the ghosts of dragons far outnumber the living.
CARD_0643_BODY;Normally docile and content to float about in search of food, these creatures can become deadly when threatened as their spines slowly fill up with a venom toxic enough to bring down a skywhale.
CARD_0644_BODY;The Topaz Yaks were born from the Mother to be the eyes of the Herd. In peaceful times they would have scouted for green pastures to graze. Now they roam ahead and trample the enemies of the herd.
CARD_0645_BODY;The rakoans have always been excellent craftsmen, they have quickly turned those talents to weapons of war. Already rakoan war machines with well trained crews can stand against the Empire’s mindless creations of steel and steam.
CARD_0646_BODY;All rakoans know that sacrifices must sometimes be made for the greater good. A few have taken it to the dangerous extreme, but no one wants to tell the rakoan with a cannon and a mad look in his eye to stop.
CARD_0647_BODY;Once great entertainers who were highly regarded in rakoan society for their ability to turn even the simplest gathering into a wondrous and magical event. Now they have turned their talents to something far more deadly, but no less wondrous and magical.
CARD_0648_BODY;I will stand by my sister. I will protect my brother. I am the shield of my people, and should I fall, another shield will always take my place. - Oath of the Shieldbearers
CARD_0649_BODY;As war spreads across Oversky, rakoans that were once outcasts because of their violent ways have become leaders as they teach their once peaceful brethren how to fight for their home and their lives.
CARD_0650_BODY;Rakoan villages are spread far and wide among the isles of Oversky, and many did not hear about what Kaios had done at the Tree of Everlife until recruiters arrived to find new soldiers for the war.
CARD_0531_BODY;There are over a million varieties of anemone floating among the expanse of Oversky. The rakoans enjoy the beauty of their many colors, the skywhales the tasty meal they provide, and the yaks the softness of their tangles when looking for a place to rest. The invading Empire did not find the anemones so delightful, as they often would get stuck in the turbines of their airships and grasp distracted drakeriders in the midst of battle. Even the Emperor was thwarted when he ordered them exterminated, since they can easily regenerate a full body from every hacked tendril.
CARD_0527_BODY;If you look carefully among the crystal fields of Oversky, you will sometimes be able to spot tortoise eggs hidden among the dream infused stones. When the eggs hatch, these gems become embedded in the hatchling's shell, growing with them in both size and power until the dreams of a thousand nights flicker across their backs.
CARD_0526_BODY;The barrier between Pandora and the waking world is not always absolute. Dreams will sometimes leak through and become bound to faeria infused crystals. The dreamkeepers eagerly collect those dreams, mesmerized by the imaginings of beings both long dead and those yet to be.
CARD_0367_BODY;During the Age of Destruction, many of the gods gave up their power to infuse the world with faeria and protect it from Ouroboros. However, a few chose to keep their power, vowing to instead take a more active role in defending creation from those who sought to destroy it.
CARD_0335_BODY;The hunters of Meluzil have always had a reputation as skilled hunters, able to take down a deer with a single stone from a hundred paces. After the Empire reduced their village to rubble and ash for defying a command to cut down the forest that was their source of food, they continued to hunt. Instead of stags and rabbits, now their prey is Imperial Caravans and tax collectors.
CARD_0316_BODY;Phoenix were once a common sight in the southern deserts before the shaytan came. The demons soon learned that they could implant a spark of their heartfire into the majestic creatures, driving them into a frenzy. These ghosts of their former selves rampage through the world, causing chaos and destruction as the Shaytan gleefully pick through the wreckage left behind.
CARD_0315_BODY;Spirits never truly die, but are recycled and reborn through the natural cycle of faeria. Sometimes things go horribly wrong with the natural cycle and a spirit will become stuck between life and death. Other lost souls will stick to them, like a clog in a drain, until a horror unlike any other in existence emerges to wreak terror and death upon the world.
CARD_0314_BODY;If you ever wander where wood and fire meet, beware the roars of the Crackthorn. Born from ash and ember, grown from seeds and vines, it is a paradox driven to rage and possessed to burn and break, tear and ruin. Should you hear its cry, like the cracking of thunder shattering tree and stone, then it is best to run. Lest it comes to crack your, bone and flesh.
CARD_0313_BODY;Two spirits, born in unison, never apart. Even when distance might divide them, their souls are one, their minds twined in perfect harmony, their purpose always the same. A perfect relationship that is outside the grasp of mortal races, even as we aspire to its beauty every day of our lives.
CARD_0312_BODY;The center of the world, far away from the heat and light of Ouroboros' eye, is a land of bitter cold and shifting landscapes. Glaciers clash with rivers of churning lava, as ancient wonders lay hidden under ice and stone. The Behemoths were once guardians of these treasures, but are now little more than wandering beasts, consuming any source of heat to survive the deadly chill of eternal winter.
CARD_0311_BODY;In all my travels, only once did I fear for my life. When among the marshes I met a true and glorious predator. It saw only prey, smelt only my weakness, felt only hunger for my flesh, and knew only its hunt for me. It was not a fight I could win, so I ran far away and hid the best I could until it found me. Then I ran again. And again. And again. Only once did I fear for my life, but that fear has never left me, for still the beast hunts. Still I am it’s prey.
CARD_0199_BODY;Devils live at the edge of the world, where their homeland is left scorched and barren by the burning eye of Ouroborus. The weakest scavenge whatever they can, while the strong eat anything weaker than themselves. The exception is the Hate Seed. Born from the loathsome and jealous flames of Ouroborus, these demons stalk only the most powerful and vicious of their peers. They wait for the moment when their prey is at its weakest and they are at their strongest before striking with all the hate and scorn of the sun.
CARD_0135_BODY;Young tikis will care for the peaceful animals that live near their villages. Adult tikis travel into the deep and wild places to help savage beasts in need. Truly ancient tikis do not seek out beasts to tend to, for they know that true harmony is found in letting nature care for them.
CARD_0109_BODY;Elementals were first created by the vortexes of energy unintentionally left by the stirring of Ouroboros, and further shaped and controlled by the Elemental gods. The gabrians, once favored of Alua, have since found ways to summon, bind, and even create new elementals of water to serve as servants and soldiers for their isolated kingdom.
CARD_0085_BODY;Innumerable creatures died during the cataclysm that marked the end of the old world, leaving behind shattered remnants of what they once were. These spirits wander in the ruins of ancient cities trying to find form and meaning in this new world. Those unlucky enough to stumble upon them are transformed into twisted mockeries of their pain and anguish.
CARD_0048_BODY;The elders of Syland have lived long, hard lives that often leave them feeble but wise. They do their best to pass this wisdom on to the younger generations, even as the wide-eyed youths dream of great adventure while trying to avoid the practical and necessary toiling in the fields.
CARD_0044_BODY;Sylanders often go hungry due to frequent and merciless raids from the barbarian clans. As they watch their fields being plundered and burned from behind stone walls, they know that another hard winter is ahead of them.
CARD_0039_BODY;Speak, Memory\nOf the unlikely hero,\nThe wanderer, taken by necessity so far from Syland\nShe who seeks a life of adventure, fortune, and noble purpose\n\nListen, Mortal\nOf all the wonders she has seen, the monsters she has faced\nThe loyal companion she rides, noble yak from the prairies of Syland\nHer mother's sword, she now wields with skill and strength\nTo one day slay the great evil threatening hearth, and native land
CARD_0014_BODY;When Sharra was badly injured by Tethra, her Master took her to a hidden monastery and played a mystic song for her every day until she was completely healed. When Sharra asked the Master about the song, he told her it was a secret he had stolen from the tikis long ago and that he knew many other songs of power that he would one day teach her.
CARD_0671_BODY;Thunder Eels are extremely rare, born only when the immense power of a lightning strike charges one of their floating eggs.  Primitive rakoans have been known to think that the eels are storm gods, and shower them with worship and gifts of precious metals.
CARD_0670_BODY;Rakoans would often plant growths from the Tree of Everlife and build shrines around them where they could leave offerings. Benevolent spirits of bounty and growth would often take residence in the shrines, providing assistance to the neighboring rakoans. When Everlife fell the trees withered away to dead husks. Now dark spirits dwell within, delighting in their torment of the rakoans that once sought blessings at the shrines.
CARD_0669_BODY;There are many ways to profit from war. Some sell weapons to both sides, others are coaxed to betrayal through generous bribes, while others scavenge the battlefield for anything that sparkles or gleams. Birds care not for such wealth though, but find profit enough in the meat and viscera swollen under the blood tinged radiance of Ouroboros’ eye.
CARD_0668_BODY;As corruption spread across Oversky, it affected first the many varied plants and animals. But as the darkness grew, it began to go deeper, twisting the very spirits of the land. Where once an elemental was content to protect its patch of sandy soil, it now had no other desire but to sap the life from all it sees and turn fertile valleys into dust choked deserts.
CARD_0667_BODY;Just as primal spirits of life are born from the blossoming of a flower, or the first breath of a infant, dark spirits emerge enmass in the wake of death, disease, and destruction. One of the foulest of these spirits is the blightborne spectre. It slithers into existence with the last rattling breath of someone who died with great suffering, and upon stealing the visage of the dead, it goes on to cause more suffering in their name.
CARD_0666_BODY;At first we thought it was the shadow and buzz of Imperial airships coming back to finish the job. But then one of my companions cried out in warning as a giant misshapen insect descended from the sky. We all ran, as fast as we could, but I was faster than most. When we returned hours later we found the corpses of the ones we had lost bloated with eggs. It took only a moment of watching the larva squirming in those eggs before we burned everybody we could find.
CARD_0665_BODY;War took its toll on the once bountiful isles of Oversky, leaving large swathes of barren and devastated land occupied by the Emperor’s armies. While many wild creatures were left struggling to survive, some vermin actually thrived under these conditions. Far happier to feast on the refuse of Imperial soldiers than scavenge in predator filled wilderness.
CARD_0664_BODY;Every spark, every ember, has a hunger you must remember\nKeep it close, and hold it tight, or else it will burn you bright\nFeed it only bits and bobs, never give it fields and logs\nOne fire is all it takes, before you find yourself charred to steaks
CARD_0663_BODY;Since times immemorial there have been mortals that bow down to any great power, even if it means their own destruction. Those who venerate Ignus are among the most self-destructive, willing to set the world to flame in order to bring glory to their master. They flock to the banner of the Emperor, believing his war will leave nothing but fire and ash in its wake.
CARD_0662_BODY;At the moment of Ignus’ birth there was nothing but the burning glory of endless flame. It is all the great elemental wishes to return to, even if it must bring the whole world burning down around it, one spark at a time.
CARD_0661_BODY;The kobolds delighted in the war taking place far away from their Empire and did everything possible to fan the flames of conflict. A favored trick was to smuggle demons into the camps of both sides, causing death and mayhem with nothing but a few well placed barrels.
CARD_0660_BODY;Everyone knows of the great war between the Empire and the natives of Oversky. An epic conflict of machine vs. nature. Few on the other hand know of the struggle between Ro88E and the mangy bear that lives in that cave by the river. But that makes it no less important for those involved.
CARD_0659_BODY;During the war, the rakoans would pack these hippos with faeria infused grains and send them running into the enemy ranks. The faeria made them quite volatile, and they would release powerful bursts of energy as they trampled through the Imperial soldiers.
CARD_0658_BODY;It emerged from the clouds, the light of Ouroboros gleaming across its bow as we all looked up in awe. Then there was a crack of thunder and a thousand rockets descended upon us. I tried to run, to hide, to do anything to save myself from the wave after wave of bombardment. I don’t know how I survived, but when I awoke and pulled myself from the rubble I was all that remained of my village. – Proudtail, Rakoan Farmer
CARD_0657_BODY;Crewed by the most daring and charming crew in the 12 Skies, the Gagana has had more adventures than a Syland farm boy could ever dream, seen wonders that Orosei wouldn’t believe, and collected treasures that the Emperor himself would marvel at. They are willing to put all that behind them though for the greatest adventure of all. Saving the world.
CARD_0656_BODY;The Imperial Navy had amassed aerial armaments for years in preparation for war. Now that they were finally given the chance to use them they were quite liberal in their application, often using 100 rockets where 1 would do.
CARD_0655_BODY;The Empire was quick to build outposts across Oversky. They served the dual purpose of subjugating the populous and extracting faeria from the land to fuel the Emperor’s many warmachines.
CARD_0654_BODY;The Obsidian Skywhales are the great predators of the heavens, using storm clouds to obscure their approach as they hunt the largest of Oversky’s many flying creatures. Shozen was the name given to the cruelest of the Obsidian Skywhales, whose hunger drove it to turn on its own kind, hunting and consuming them one by one. The corruption of Oversky has not made Shozen’s disposition any better.
CARD_0653_BODY;There is no place in Oversky that the Emperor’s corruption did not touch, no place so sacred or pure that it was spared. Forests became blights, towns turned into ruins, and places of blessings were twisted into monuments to curses.
CARD_0652_BODY;Twelve priests tended the Temple of Everlife during day, and twelve during night. All twenty and four stood in opposition of the Emperor when he took the tree. Sixteen were slain as an example to those who resisted. Three escaped to warn others of the sacrilege that took place. Two joined willingly with the Emperor and were given places of honor within his court. The last three were bound in chains and magic, their will no longer their own.
CARD_0258_BODY;The oradrim knights of the Djidan Order can use the faintest breeze to travel almost anywhere with the speed of thought. Less gifted oradrim require the use of the wind gates to channel their latent powers to move around the desert.
CARD_0517_BODY;The lifecycle of the flash salmon is amazingly short. They hatch from their eggs in cool, fertile ground and wait there until their wings fully form. They then dart from the hot sands and take to the air, eating everything they can. They fly until they find another island, then burrow under the ground to lay their eggs and die.
CARD_0359_BODY;All things must come to an end, it is true. It is my belief though that those who follow the path of unrighteousness should find that end sooner than those who live lives of justice and harmony. - Khalim
CARD_0307_BODY;Traveling through a sandstorm is bad enough without the sand actively trying to force its way down your throat.
CARD_0265_BODY;The shaytan priests of Ouroboros gain great power in dark and terrible places. Each soul they feed to the Endless Serpent increases Its power while removing from the world a bit of the faeria that protects all of creation.
CARD_0240_BODY;At the edge of the world under the heat of Ouroboros’ Eye, faeria boils and congeals into a hard substance called bloodstone. Some sprites feed on this red, essence-infused rock, turning into twisted and hateful things that delight in the pain of others.
CARD_0094_BODY;The essence of dreams can craft anything that can be imagined. Object or person, living or dead, it does not matter as long as someone remembers its existence in the deep imaginings of their slumber.
CARD_0073_BODY;Each crashing wave contains a drop of faeria. Every tide flows with its glorious essence, and every ebb and sway of the ocean swells with its power. This is our inheritance from the sea. Woe to any enemy that forces us to use what we have been given cycle after cycle.
CARD_0127_BODY;Emperor Kaios performed many experiments in his pursuit of godhood. While none gave him the ultimate results he was hoping for, he still learned much in their failure.
CARD_0042_BODY;The faeria-fueled siege engines of the Mîrnast Empire are some of the most destructive weapons in existence. Given enough time, a single engine can reduce any fortress to dust and rubble.
CARD_0360_BODY;BZZZZZZZZZZZZZZZZZZZZZZZZZZZZZZZZZZZZZZZZZZZZZZZZZZZZZZZZZZZZZZZ BZZZZZZZZZZZZZZZZZZZZZZZZZZZZZZZZZZZZZZZZZZ BZZZZZZZZZZZZZZZZZZZZZZZZZZZZZZ BZZZZZZZZZZZZZZZZZZZ BZZZZT…\n\nBZZZZZZZZZZZZZZZZZZZZZZZZZZZZZZZZZZZZZZZZZZZZZZZZZZZZZZZZZZZZZZZZZ
CARD_0673_BODY;Once the most loyal and dutiful servant of the Emperor, Banon came to realize that Kaios had gone too far down the mad path of power to be saved. Though Banon now stands against his friend and lover, he loves him no less than the day he swore his oath and heart to him.
CARD_0248_BODY;In a desperate attempt to stop Seifer and his armies, the Lords of Terror sacrificed many of their own to summon a giant orb of flame and stone. When the dust and embers cleared, Seifer still lived with much of his army. He made short work of the weakened devil forces, driving the Lords of Terror into shame and exile.
CARD_0679_BODY;There was once a triton lord so gluttonous and wealthy that he ordered a hundred dishes each cooked by a hundred chefs and fed to him by a hundred servants. He ate, and he ate, until every dish was gone. When he called on the servants to bring him more, however, he found that they were all gone.
CARD_0692_BODY;Everyone sees the big and strong. They worship, serve, or fear them. No one pays attention to you, though. They hunt and hurt you. Come, little one. Let me hold you and keep you safe until I grow you strong enough that you can protect yourself.
CARD_0691_BODY;There is no greater joy than that of a righteous war well-fought and won. All the pain, the sorrow, and the hardship serve to bring the celebration to heights as impossible as the victory itself.
CARD_0690_BODY;At the eve of battle, the winds whispered his coming. The air trembled with his might. Dwordia, the first Chieftain, rode from the Distant Isles to bring vengeance upon the abomination that had defiled the lands he had sworn to protect in life. When the deed was done and Kaois was slain, he vanished once more with a breeze, content to return to his rest once more.
CARD_0689_BODY;Rarely seen but often felt, the Zephyrs are born from the last breath of an innocent soul and tasked to watch over them. They carry their ward to the Distant Isles and then run errands for them in the living realms, gathering gossip or snatching up their favorite foods.
CARD_0688_BODY;Despite the devastation left by the war, the land was quick to be regrown. Nurtured in life and fertilized in death, overgrown forests soon covered the Oversky thanks to the zealous work of these fertile tree spirits.
CARD_0687_BODY;While many of the priests were killed when the Overmind took the Tree, a handful escaped to warn others of his atrocities. They roamed Oversky tirelessly, rallying every person and wild thing to the protection of their communal home.
CARD_0686_BODY;We answer your call. The smoke of your anguish. The ashes of your pain. The cries of your twisting timber and cracking limbs. We answer your call. All the strength of Erianor comes as one.
CARD_0685_BODY;Wrapped in life and magic. Woven by Gaea's love. Kept safe and warm within nature's womb until the time comes to once more wake to your new birth.
CARD_0684_BODY;Unable to as easily spread themselves as their aquatic cousins, the coral of Oversky depends on these graceful beasts to carry them from isle to isle. In exchange, the coral stores faeria within its intricate living structures, imbuing the creature with power it can use to protect itself and its charge.
CARD_0683_BODY;While the gabrians were not able to lend much aid to the war raging far above their ocean home, they provided plenty of assistance in throwing the victory party.
CARD_0682_BODY;The Tide Lord's blessing be upon you, my friend. His waves will carry you to warm waters, his trident will protect you, and the tides under his command will bring you tasty fish all the days of your life.
CARD_0681_BODY;It took more than strength of arms to defeat Kaios and his forces. While many races lent their weapons and expertise to the task, it was the triton tacticians that planned the final battle and won the day.
CARD_0680_BODY;In every mirror I've looked before, I've seen only my reflection. But in these I've found that it was them seeing their own reflection in me.
CARD_0678_BODY;The rakoa used to find herds of yaks stranded on tiny islands devoid of grass and water. While some may call their solution to the problem utterly mad, the yaks themselves find it quite adequate as long as they have enough space for a running leap.
CARD_0677_BODY;Where did Hosa get to now?!
CARD_0676_BODY;Hosa was a wild yak, who liked to run away. Even though the shepherd tried, there was nothing they could do or say. Hosa would be calm and good, until they looked away. Then he would run far and wide, just to get all of that tasty hay.
CARD_0675_BODY;The Llamacorn is the subject of many myths and superstitions. It is said that a jacket made of its wool will make you irresistible to others. Its ground up horn will purify the most foul of waters. Its dung makes an excellent additive to the best of beers. It is a wonder that the whole species isn't rounded up into farms or hunted to extinction by now.
CARD_0674_BODY;It is over, Kaios. I stood aside once before, but never again will I yield to the likes of you!
CARD_0529_BODY;The isles of Oversky drift according to the ebbs and flows of the skytides. Because this is very inconvenient for anyone living on these islands, Towships are invariably a booming business.
CARD_0528_BODY;There are few things more beautiful and glorious to behold than the flight of a thousand mantas against the shimmering light of a fading storm.
CARD_0524_BODY;Dazzling, majestic, and incredibly dangerous, these swordfish were trained by the Skyward Merchant's Company to guard their air convoys throughout Oversky.
CARD_0523_BODY;The soothing warmth that the emerald salamander emits when among friends can quickly grow blazing hot when threatened. Always make sure you are their friends.
CARD_0510_BODY;When Kaios first arrived in Oversky, the rakoa greeted him with a bounty of gifts to honor the friendship that could exist between them. Kaios only saw such gifts as weakness, and the rakoa fit for nothing more than tribute.
CARD_0508_BODY;Born from the Tree of Everlife and infused with pure faeria, these seeds contain entire worlds in a deceptively simple container.
CARD_0503_BODY;No one knows why someone thought it was a good idea to create a contraption designed to throw yaks at people. Regardless, it turned out to be a pretty effective method of persuading enemies to leave you alone. No one likes getting hit by a flying yak.
CARD_0372_BODY;Iona's frown can cripple a man. Her laughter can ignite a funeral into a celebration. As for her smile...creatures from distant lands will travel a thousand leagues just to bear witness.
CARD_0371_BODY;It is well known that Krog will eat anything...except yaks. He tried one once, but the wool tickled the back of his throat. Now he just keeps yaks around because he thinks they must be funny since the one he ate made him laugh.
CARD_0370_BODY;They appear from nowhere and strike you down before you even have a chance to blink. At best, all you can hope to do is draw a bit of their blood in the struggle. You must kill them as they kill you.
CARD_0369_BODY;A fragment of a dream is a weak and wistful thing, but give it the purpose of a thousand sleeping minds and it can crush kingdoms and topple giants.
