CARD_0226_BODY;這種機械體異常亢奮。他們能夠噴射出成束的火焰，卻總喜歡剛一點火就把烈焰噴得到處都是。如果你要將他們的噴火能力用於烹飪或是焊接鋼管，那麼最後的結局只會是燒掉大半個鎮子。
CARD_0224_BODY;機械體利用高速軌道運輸系統在其領地的主要城市之間運送貨物和武器。而對於那些更為偏遠的地區，或是在頻繁的侵略戰爭中，它們就得依賴更為強大的運輸機械體來攜帶軍備物資。
CARD_0223_BODY;作為一種由精湛技藝匠心打造，每件齒輪、每個活塞都彰顯出完美製作工藝的造物，機械體無疑會特別鍾情於大肆破壞。
CARD_0196_BODY;在帝國鼎盛時期，狗頭人們建造了堅固的堡壘，讓整個世界都遍佈隧道、地下墓穴和無數洞穴。堡壘的城牆和大門永遠不會因外力的攻擊而損毀，卻很輕易地就因內訌和叛亂而毀於一旦。
CARD_0181_BODY;奇跡之地瓦爾西裡翁位於世界的中心。在這裡，眾神透過強大的元素能量旋渦創造出世界。在這裡，憑藉堅強的意志和足夠的仙靈就能夠創造或改造出任何事物，從而加速世界的創造進程。
CARD_0180_BODY;在環繞蓋婭母樹生長開的雨林中能夠發現神秘的哭泣偶像。關於這些哭泣偶像從何而來的傳說眾說紛紜，而只有極少數人才知道事實的真相：他們都是蓋亞的孩子，在母神犧牲自己的時候傷心哭泣而變成了石頭。現在，他們不僅為母神的離去而哭泣，也為所有生命的逝去而悲傷。
CARD_0176_BODY;所有堤基族人都崇拜神聖的動物並且特別敬畏茹妮，而少數堤基人已經向茹妮效忠，宣誓接受捍衛林地的神聖使命。他們騎在神聖狼騎的悲傷，在曠野的邊界展開巡邏，並在發現任何威脅時為綠色聯盟預警。
CARD_0171_BODY;仙靈是身形微小而能量強大的精靈，它們總是緊隨在四大元素神明身邊。在沒有獲得蓋亞的指導時，花錦仙靈會存在於任何富含大量生命本源的地方。這些地方通常會遍佈參天古樹，但眾所周知的是，它們也會跟隨在巨獸或人類強者身邊。
CARD_0157_BODY;仙靈廣泛存在於所有物體和一切生靈中。但是，它也如同流水一般，會流淌、匯聚到水池和湖泊中。並且，紮根其上的樹木也會像吸收水分一樣，努力將所有faeria吸取乾淨；而後成為某些神聖能量的承載體，或是成為照亮另一些生命與力量的生命燈塔。
CARD_0155_BODY;茹妮幾千年來一直是堤基眾部落的守護者，可她畢竟無法兼顧每一寸土地。在絕望的年代裡，薩滿們在她的神殿周圍聚集，祈求她的幫助。他們寄希望于得到女神的守護，然而有時候她只能為提基們提供精神寄託。
CARD_0128_BODY;想要動搖強者的心智需要創造最為宏大的幻象，然而要操控弱者的意志，只需要一段白日夢、一個單詞，甚至僅僅是一個簡單的詭計。
CARD_0126_BODY;水之女神奧拉創造加百列人的時候，曾賦予他們一副能夠發展並守護海洋的神聖任務。喚浪者們虔誠而鄭重地承擔下了這項使命，甚至將自己的身體與水元素融合，以便能夠更熟練地掌控波濤與潮汐。
CARD_0117_BODY;在上古世界遺留下來的失落神廟裡，有時候能夠發現一些奇怪的脈動著的蛋。沒人知道它們會孵化出什麼來。因此，人們總是把村莊建遠離可能發現這些蛋的地方，以防它們孵化出龍或者什麼其他邪惡怪獸。
CARD_0116_BODY;盧達安經常被人們錯認為鬼魂或者精靈，它其實是曾經癡迷仙靈的人類，不惜將仙靈作為了自己的唯一飲食，最終淪落至此。
CARD_0110_BODY;仙靈是身形微小而能量強大的精靈，它們總是緊隨在四大元素神明身邊。寶錦仙靈曾經漫無目的地在湖泊與海洋之上遊蕩，但最近，它們已經開始在加百列水域聚集。
CARD_0106_BODY;……後來啊，奧拉跑到了老蛇的尾巴上，可烏洛波羅斯緊緊追住奧拉並合上了下巴，伴著一道雷光，它終於將女神一口給吞了下去，可也將自己的尾巴吃掉了。這就是我們偉大的女神怎樣欺騙烏洛波羅斯吞掉自己尾巴，免得它吞噬掉世界其他地方的故事。好了好了，都去睡覺吧！外公累啦。
CARD_0086_BODY;如果你親眼目睹過一位崔頓大廚工作時的場景，就不會對他們為純粹烹飪藝術所做出的努力產生任何懷疑。烘烤那些產自高魔地區破肯角的巨型水果需要堅忍的精神品格與高超的烹調技藝，因為只有極少數廚師才能夠在烹飪完成之前抵擋住吃掉它們的誘惑。
CARD_0062_BODY;在莫納斯特帝國，仙靈是最有價值的資源。很多莫納斯特的年輕人賭上自己的一切，冒險從神聖森林的樹精手中偷竊仙靈。儘管倖存者寥寥無幾，但他們獲得的財富與名望卻足以鼓動下一代人繼續嘗試這種九死一生的冒險。
CARD_0061_BODY;任何反抗莫納斯特帝國現狀的人都會被打上罪犯的烙印，並會被從安定繁榮的城市中驅逐出去。這些不法之徒們很快就會投靠叛軍，而叛軍的腦袋很快就會值很高的賞金了。
CARD_0054_BODY;每個時代，總會有男男女女將大好青春年華耗在追尋名望與財富的冒險之中。不幸的是，當他們意識到蠻勇無法替代智慧與技巧的時候，往往已經太遲了。
CARD_0045_BODY;在麥洛瓦，瑪戈努斯國王一直忙於調停貴族間的紛爭，而普通公民的正義則是交由皇室法官伸張。然而，王國的臣民們都知道，不論是高等法院還是普通法院，都已受女王瑪戈妲操控，用來實現女王大人的意志。
CARD_0032_BODY;儘管犛牛平時溫順又可愛，可這種生物一旦被激怒，恐怕這個世界上再沒有什麼能夠匹敵犛牛的怒火。
CARD_0009_BODY;早在帝國建立之前，莫納斯特工程學院就一直在改進由仙靈驅動的機械裝置。
