OVERSKY_EXPLORER_0001;Coopérez avec votre allié pour vaincre votre adversaire.
OVERSKY_EXPLORER_0002;Fuyez pauvres fous. Vous ne sauverez pas la grenouille.
OVERSKY_EXPLORER_0003;Mes amis sont bien plus forts que vous ne le pensez !
OVERSKY_EXPLORER_0004;Faites vite, ces chaînes sont très inconfortables.
OVERSKY_EXPLORER_0005;Ces terres appartiendront à l'Empereur.
OVERSKY_EXPLORER_0006;Ils essayent la torture par l'eau. Dépêchez-vous avant qu'ils ne se rendent compte que je suis une grenouille !
