OVERSKY_ISLAND_01_MISSION03_0001;The empire's technology is preventing the egg from hatching. Break it to free the baby inside.
OVERSKY_ISLAND_01_MISSION03_0008;We won't let you hatch the egg.
OVERSKY_ISLAND_01_MISSION03_0002;Just try and stop us.
OVERSKY_ISLAND_01_MISSION03_0004;We need to crack that egg to help it hatch.
OVERSKY_ISLAND_01_MISSION03_0005;*Wobble. Wobble.*
OVERSKY_ISLAND_01_MISSION03_0006;It's working! The damage is helping the egg hatch.
OVERSKY_ISLAND_01_MISSION03_0007;Yes! It's hatching!
