CHALLENGE_01_0001;Du hast genau EINMAL die Chance, Fugoro zu schlagen. Solltest du verlieren, kannst du es nicht noch einmal versuchen.
CHALLENGE_01_0002;Ich habe diese Urne aus dem Grab des ersten Kaisers von Gabria ausgeliehen.
CHALLENGE_01_0003;Manche behaupten, diese lebendige Statue sei einst die Schwester Oroseis gewesen.
CHALLENGE_01_0004;Der Hohepriester Sario hatte unendlich viel Spaß mit seinen Opfern. Und unendlich ist dabei wörtlich zu verstehen.
CHALLENGE_01_0005;Hat den ersten Platz gemacht beim jährlichen Wettbewerb „Bau den besseren Erdkrustenbrecher“.
CHALLENGE_01_0006;Für diese Schönheit musste ich mich in Garudans Berg schleichen.
