OVERSKY_ISLAND_01_MISSION01_0001;Arbeite mit deinem Verbündeten zusammen um den Gegner zu besiegen.
OVERSKY_ISLAND_01_MISSION01_0002;Verschwindet, ihr Narren. Ihr werdet den Frosch nicht retten.
OVERSKY_ISLAND_01_MISSION01_0003;Meine Freunde sind deutlich mächtiger, als du denkst!
OVERSKY_ISLAND_01_MISSION01_0004;Beeilt euch, diese Ketten sind echt unbequem.
OVERSKY_ISLAND_01_MISSION01_0005;Dieses Land wird in den Besitz des Imperators übergehen.
OVERSKY_ISLAND_01_MISSION01_0008;Hier! Nimm das.
OVERSKY_ISLAND_01_MISSION01_0006;Sie versuchen mich mit dem Einsatz von Wasser zu foltern. Beeilt euch, bevor sie bemerken, dass ich ein Frosch bin!
OVERSKY_ISLAND_01_MISSION01_0007;Sehr gut, so erfolgreich kann man sein, wenn man zusammenarbeitet.
