FUGORO_EPIC_01_0001;Disfruta con estos tesoros de muestra.
FUGORO_EPIC_01_0002;He tomado prestada esta urna de la tumba del primer emperador gabriano.
FUGORO_EPIC_01_0003;Algunos dicen que esta estatua viviente fue, una vez, la hermana de Orosei.
FUGORO_EPIC_01_0004;El gran sacerdote Sario se divirtió eternamente con sus víctimas. Literalmente.
FUGORO_EPIC_01_0005;¡Este ganó el concurso anual de Construye el mejor volcán!
FUGORO_EPIC_01_0006;Tuve que colarme en la montaña de Garudan para hacerme con esta belleza.
