CARD_0508_BODY;Tato semena, zrozena ze Stromu Nesmrtelna a plná čiré faerie, ve svých drobných schránkách ukrývají celé světy.
CARD_0503_BODY;Dodnes tak nějak zůstává jakousi záhadou, jak si někdo vůbec mohl myslet, že stroj na vrhání jaků zní jako dobrý nápad. Jakmile ale spatřil světlo světa, ukázalo se, že jde o poměrně funkční metodu, jak dát nepříteli najevo, že vás má nechat na pokoji. Dostat do hlavy létajícím jakem jaksi není zrovna kdovíjak lákavé.
CARD_0372_BODY;Ionino zamračení dokáže přivodit vážná zranění. Její smích dovede přeměnit pohřeb v oslavu. Co se jejího úsměvu týče... mnozí cestují tisíce mil, jen aby jej z dálky spatřili.
CARD_0371_BODY;Je dobře známo, že Krog je schopen sníst cokoliv... tedy kromě jaků. Jednou se o to pokoušel, ale hebká vlna jej lechtala v krku. Od té doby si myslí, že jaci musí být moc legrační, když ho ten jeden tolik rozesmál. Proto je rád v jejich přítomnosti.
CARD_0370_BODY;Objeví se odnikud a vmžiku udeří. To nejlepší, co člověk může udělat, je zkusit v souboji prolít i trochu jejich krve. Pomstít svůj život, který je již ztracen.
CARD_0369_BODY;Střípek snu je slabá a tichá věc, ale dejte mu význam tisíce spících myslí a rozdrtí království a svrhne obry.
CARD_0368_BODY;Císařovy rozkazy obvykle stojí na svitcích černého pergamenu převázaných fialovou hedvábnou mašlí. Rozkaz je napsán jeho vlastní rukou zlatým inkoustem, pečeť je vytlačena do purpurového vosku. Ačkoliv k tomu ty, kterých se rozkaz týká, neváže žádné kouzlo, nikdy by si nedovolili neuposlechnout. To dělají pouze císařovi nejzapřísáhlejší nepřátelé.
CARD_0358_BODY;Oko Ourobora, které leží na samém okraji světa, nezáří na všechna místa rovnoměrně. Ty, kdo se v jeho plném svitu octnou sami, čeká utrpení. Ale komu se podaří správně jej nasměrovat, rozdrtí své nepřátele.
CARD_0355_BODY;Kodama obvykle o moc dlouho nepřežije strom, k němuž je vázána. Je však několik vzácných výjimek, které zdivočí a soustředí se pouze na likvidaci kohokoliv, kdo by chtěl ublížit lesu.
CARD_0354_BODY;Ačkoliv tyto bytosti obvykle pojídají sny, nemají problém čas od času slupnou i nějakého toho boha. Neboť čím jiným jsou bohové než představami spojenými s účelem, možnostmi smíšenými s provedením, sny, jimž byl dán tvar.
CARD_0319_BODY;Když se Himsaël, první z merovalských králů, vrátil ze svých cest po světě, založil věhlasnou královskou akademii průzkumníků, osadníků a kartografů. Dodnes tvoří ty nejpodrobnější mapy na světě.
CARD_0302_BODY;Tyto obří zmutované obludy jsou ve skutečnosti prastaří shaytané, kteří musí neustále pojídat duše, aby přežili. Naštěstí se s těmito zrůdami setkáte jen jednou: pár vteřin před smrtí.
CARD_0298_BODY;V noci je tvé oko přehlédne. Za dne se skryjí ve tvém stínu. Ty nejnebezpečnější věci nejsou obrovské a zuřivé. Ty nejnebezpečnější věci číhají v tichu.
CARD_0294_BODY;Než Ouroboros procitl a pokusil se pohltit svět, obři větru chovali všemožné druhy ptáků uvnitř těchto zlatých voliér. Byť už nejsou jako dříve, mají tato místa stále své kouzlo.
CARD_0293_BODY;Kdo si přeje pomoc větru, musí pochopit jeho spontánní povahu. Kdo chce být přítelem větru, musí se k němu jako přítel chovat. - Khalim
CARD_0290_BODY;Víly hedváběnky jsou drobní, ale mocní duchové. Kráčely vždy ve stopách čtyř bohů živlů. Bez světla svého boha, které by mohly následovat, se sluneční hedváběnky bezcílně potulovali, než je solarové vpustili do svých měst. To jim dalo nový cíl a domov.
CARD_0278_BODY;Jenom keldrané dovedou trénovat pouštní drakóny a projíždět se na nich. A dokonce i mezi nimi se mistr drakóních jezdců těší ohromné úctě. Patří mezi elitní keldrany, smrtící žoldáky, kterým platí samotní nejbohatší princové amaiského obchodu.
CARD_0257_BODY;Pravý vládce větru nikdy nechodí pěšky.
CARD_0255_BODY;V každé bitvě proti zkaženému bohu uděří vždy nejdříve střelci. Tím, jak sprškou šípů pokropí a oslabí řady nepřítele, povzbuzují své spojence, aby s nasazením všech sil bojovali proti těm, kdo by chtěli zneužít posvátnou esenci světa.
CARD_0246_BODY;Tyto rozpadající se artefakty bývaly kdysi jedny z nejmocnějších zbraní použitých ve válce obrů. Ačkoliv jsou na nejlepší cestě stát se obyčejnými hroudami kamení, mnoho jich nějakým způsobem přežilo své tvůrce.
CARD_0244_BODY;Jak mohli nechat Aora zemřít? Jak se mohou smrtelníci nadále klanět jiným bohům. Astar byl slabý, Alua nic neudělala, Gaeu zajímaly pouze její drahé stromky... A teď se smějí? Jak se mohou veselit a hodovat, když největší z bohů padl?! Zaplatí za svůj nedostatek úcty! - Garudan
CARD_0237_BODY;Sutiny a trosky, hřmot a třesk. Ať žije hromochod, bouchkrok a zemětřes.
CARD_0234_BODY;Víly hedváběnky jsou drobní, ale mocní duchové. Kráčely vždy ve stopách čtyř bohů živlů. Od Aorovy smrti se plamenné hedváběnky instinktivně shlukují kolem jakéhokoliv většího zdroje ohně. Láká je podobně, jako kdysi jejich patron.
CARD_0226_BODY;Tito mechové jsou nezvykle roztěkaní. Ačkoliv obvylle dokážou koncentrovat své plameny do soustředěných paprsků, často hned po zažehnutí pokropí plameny všechno okolo. Z toho, co mělo být pouhým příjemným táborákem nebo svařenou rourou, se tak může stát polovina města v plamenech.
CARD_0224_BODY;Mechové pro převážení surovin a zbraní mezi svými nejdůležitějšími městy používají systém vysokorychlostních vozíků. Ve vzdálenějších místech (nebo během některé z jejich četných invazí) se musí spoléhat na silné mechanické šerpy, kteří nosí zbraně a munici.
CARD_0223_BODY;Na bytosti vytvořené s takovou pečlivostí, ve kterých je každý píst a každé kolečko dokladem o řemeslné dokonalosti, si mechové až podezřele vyžívají v ničení věcí.
CARD_0196_BODY;Za doby největší slávy své říše stavěli koboldi nedobytné pevnosti, které svou sítí tunelů, sklepení a chodeb zasahovaly do celého světa. Jejich zdi a brány by nikdy nevpustily nepřítele zvenčí, ale často padly pod náporem vnitřních hádek a povstání.
CARD_0181_BODY;V samém středu světa leží magický Valsîrion. Zde bohové stvořili svět z mocných vírů energie živlů. Je zde možno vytvořit cokoliv, stačí pevná vůle a dostatek faerie, která tyto živelné kovárny uvede do pohybu.
CARD_0180_BODY;Tajemné plačící modly lze nalézt rozesety po deštných lesech kolem Stromu Gaey. Byť existuje mnoho legend o jejich původu, málokdo zná pravdu: Bývaly to děti Gaey, které zkameněly, když se bohyně obětovala. Nyní pláčou, nejen pro jeji ztrátu, ale pro smrt každé živé bytosti.
CARD_0176_BODY;I když všichni tikijové uctívají posvátná zvířata a vzdávají čest především Ruunin, jen několik z nich se plně oddalo jejímu odhodlání bránit lesy. Uhání na hřbetech požehnaných vlků, střeží hranice divočiny a varují Zelenou alianci před každým nebezpečím, na něž natrefí.
CARD_0171_BODY;Víly hedváběnky jsou drobní, ale mocní duchové. Kráčely vždy ve stopách čtyř bohů živlů. Když je teď nevede Gaea, květinové hedváběnky žijí kdekoliv, kde je to plné života. Ačkoliv to obvykle bývají místa plná prastarých stromů, ví se o nich, že často sledují velké šelmy nebo obzvláštně urostlé lidi.
CARD_0157_BODY;Faerie je všude kolem. V každé živé bytosti, v každé věci. Ale, podobně jako voda, také proudí a střádá se v jezerech a jezírkách. A, podobně jako je to s vodou, stromy s hladovými kořeny ji nasají, čímž se pro mnohé stávají posvátnými nositeli božské energie. Anebo živými nádobami na bohatství a moc.
CARD_0155_BODY;Ruunin byla ochránkyní tikijských kmenů po tisíce let, ale nemůže být všude zároveň. V časech nouze se šamané shromáždují kolem jejích svatyň a prosí o pomoc. Doufají, že jim poskytne ochranu, ale mnohdy může nabídnout pouze pomoc svého ducha.
CARD_0128_BODY;K odklonění myslí silných je potřeba grandiózních vizí, ale slabí mohou být snadno ovládnuti pouhou představou, slovem nebo jednoduchou lstí.
CARD_0126_BODY;Když Alua, bohyně vody, stvořila Gabriany, dala jim posvátný úkol tvarovat oceán a pečovat o něj. Vlnotvůrci tento úkol vzali velmi vážně a často zašli až tak daleko, že spojilli svá těla s vodními elementály, aby dokázali lépe kontrolovat proudy vody.
CARD_0117_BODY;V prastarých ztracených chrámech lze občas najít drobná, pulzující vajíčka. Nikdo netuší, co se skrývá uvnitř, ale pro případ, že by to byl drak nebo jiná obluda, lidé raději staví své vesnice daleko od takových míst.
CARD_0116_BODY;Luduany si ostatní často pletou s duchy. Ve skutečnosti jde pouze o lidské bytosti, které se staly zcela závislými na faerii, až přestaly jíst či pít cokoliv jiného.
CARD_0110_BODY;Víly hedváběnky jsou drobní, ale mocní duchové. Kráčely vždy ve stopách čtyř bohů živlů. Křišťálové hedváběnky kdysi bezcílně bloudily u jezer a oceánů, ale nedávno se začaly shromažďovat nad vodami Gabrie.
CARD_0106_BODY;... A poté Alua běžela po ocase prastarého hada, když kolem ní Ouroboros sevřel své čelisti. Za hřmotu a záblesku světla obojí spolkl. A tak naše mocná spasitelka přelstila Ourobora a donutila jej pozřít vlastní ocas, aby nemohl spořádat zbytek světa. A teď huš do hajan, dědeček už potřebuje spát!
CARD_0086_BODY;Kdo spatří vařícího tritonského šéfkuchaře, nemá pochyb, že hledí na ztělesnění kuchařského umění. Pražení a příprava obřího ovoce z magického Puken'pinu vyžaduje tu nejvyšší úroveň duševní odolnosti a kuchařského umění, protože slabší povahy neodolají a všechno snědí, než stihnou dovařit.
CARD_0062_BODY;V Mîrnastu není vzácnější suroviny, než je faerie. Mnoho mladých Mîrnasťanů riskují vše, jen aby jí trochu nakradli nymfám z Posvátného lesa. Jen málo se jich vrátí, ale ti, kterým se poštěstí, se těší bohatství a slávě dost velké na to, aby inspirovali novou generaci amatérských dobrodruhů.
CARD_0061_BODY;Kdokoliv nesouhlasil s poměry Mîrnastské říše byl označen za zločince a vykázán z pohodlí bezpečných říšských měst. Odpadlíci se rychle stávají rebely a na hlavu rebela je vždy rychle vypsána odměna.
CARD_0054_BODY;V každé době budou žít muži a ženy ochotni riskovat sílu a elán svého mládí pro slávu a bohatství. Jaká škoda, že si často až velmi pozdě uvědomí, že odvaha a troufalost jsou chabými náhradami za moudrost a zručnost.
CARD_0045_BODY;Říká se, že v Merovalu král Magnus zprostředkovává rozhovor mezi vládnoucí šlechtou, zatímto královi soudci mají na starost řadové poddané. Zasvěcení ale vědí, že skutečnou moc drží královna Magda, která dle vlastní vůle manipuluje všemi vrstvami královského dvora.
CARD_0032_BODY;Ač jsou obvykle krotcí a roztomilí, není na tomto světě větší vztek než vztek rozčíleného jaka.
CARD_0009_BODY;Již dávno před vznikem Říše Mîrnastská akademie inženýrství neúnavně vylepšovala své faerií poháněné stroje.
